{
  "schema_version": 2,
  "id": "EXP-13-01",
  "chapter": 13,
  "status": "smoke",
  "claim_ids": ["CLAIM-13-01", "CLAIM-13-02", "CLAIM-13-05", "CLAIM-13-06", "CLAIM-13-07"],
  "claim_scope": [
    "equal teacher-forced action RMSE and MAE can hide temporal sign correlation and different state-integration outcomes",
    "holding prediction horizon fixed while increasing execution horizon can reduce policy queries while increasing stale-action reaction delay",
    "the fixed oldest-first exponential temporal ensemble reduces stationary jitter but lags a real target change"
  ],
  "code": {
    "repository": "cv2embodied",
    "commit": "UNCOMMITTED",
    "config": "standard-library v3 imitation, temporal-correlation, execution-horizon, and temporal-ensemble fixture"
  },
  "data": {
    "name": "procedural action-correlation, perturbation-timing, and overlapping-prediction fixture",
    "version": "v3",
    "license": "MIT",
    "classification": "fixture",
    "fixture": true,
    "download_bytes": 0
  },
  "resources": {
    "tier": "S",
    "device": "CPU",
    "duration_seconds": 0,
    "peak_vram_bytes": null,
    "disk_bytes": 0,
    "gpu_verified": false
  },
  "commands": {
    "smoke": "make ch13-smoke",
    "evaluate": "python3 labs/track-b-policy/ch13-imitation/scripts/smoke.py",
    "report": "python3 labs/track-b-policy/ch13-imitation/scripts/smoke.py"
  },
  "metrics": [
    {"name": "open_loop_action_rmse", "value": 0.02, "unit": "action", "split": "procedural-fixture"},
    {"name": "persistent_integrated_final_state_error", "value": 0.4, "unit": "state", "split": "temporal-correlation"},
    {"name": "alternating_integrated_final_state_error", "value": 0.0, "unit": "state", "split": "temporal-correlation"},
    {"name": "alternating_maximum_absolute_state_error", "value": 0.02, "unit": "state", "split": "temporal-correlation"},
    {"name": "prediction_horizon_steps", "value": 8, "unit": "steps", "split": "execution-policy"},
    {"name": "execution_1_policy_queries", "value": 16, "unit": "count", "split": "execution-policy"},
    {"name": "execution_8_policy_queries", "value": 2, "unit": "count", "split": "execution-policy"},
    {"name": "execution_8_max_reaction_delay", "value": 7, "unit": "steps", "split": "execution-policy"},
    {"name": "stationary_temporal_ensemble_absolute_error", "value": 0.000999991667, "unit": "action", "split": "stationary-overlap"},
    {"name": "changed_temporal_ensemble_absolute_error", "value": 0.753737406774, "unit": "action", "split": "changed-overlap"}
  ],
  "artifacts": ["results/ch13/EXP-13-01-smoke.json"],
  "limitations": [
    "hand-designed scalar integrator without observation-dependent feedback rather than a learned BC or ACT policy",
    "reaction delay is measured in abstract steps without robot timing jitter",
    "temporal predictions are four hand-authored scalars rather than model outputs",
    "demonstrates protocol trade-offs, not expected real-task effect sizes"
  ]
}
