{
  "schema_version": 2,
  "id": "EXP-02-01",
  "chapter": 2,
  "status": "smoke",
  "claim_ids": ["CLAIM-02-01", "CLAIM-02-02", "CLAIM-02-03", "CLAIM-02-04"],
  "claim_scope": [
    "classify candidate systems by representation dynamics conditioning and use",
    "separate VLA policies video predictors simulators and learned world models",
    "record unsupported capabilities instead of inferring them from names"
  ],
  "code": {
    "repository": "cv2embodied",
    "commit": "UNCOMMITTED",
    "config": "standard-library validation of fixtures/system-cards.json"
  },
  "data": {
    "name": "official paper and repository metadata worksheet",
    "version": "v1",
    "license": "MIT for original worksheet; upstream sources retain their licenses",
    "classification": "fixture",
    "fixture": true,
    "download_bytes": 0
  },
  "resources": {
    "tier": "S",
    "device": "CPU or browser",
    "duration_seconds": 0,
    "peak_vram_bytes": null,
    "disk_bytes": 0,
    "gpu_verified": false
  },
  "commands": {
    "smoke": "make ch02-smoke",
    "evaluate": "python3 labs/track-a-world-model-control/ch02-system-cards/scripts/smoke.py",
    "report": "python3 labs/track-a-world-model-control/ch02-system-cards/scripts/smoke.py"
  },
  "metrics": [
    {"name": "system_card_count", "value": 8, "unit": "cards", "split": "fixture-v1"},
    {"name": "category_count", "value": 8, "unit": "categories", "split": "fixture-v1"},
    {"name": "cards_with_evidence", "value": 8, "unit": "cards", "split": "fixture-v1"},
    {"name": "cards_with_unsupported_claims", "value": 8, "unit": "cards", "split": "fixture-v1"}
  ],
  "artifacts": ["results/ch02/EXP-02-01-smoke.json"],
  "limitations": [
    "classification is use-dependent rather than a universal ontology",
    "individual projects must be checked at a pinned version before runtime claims",
    "paper and documentation metadata were summarized rather than runtime-tested"
  ]
}
