{
  "schema_version": 2,
  "id": "EXP-08-01",
  "chapter": 8,
  "status": "smoke",
  "claim_ids": ["CLAIM-08-02", "CLAIM-08-03", "CLAIM-08-04", "CLAIM-08-07", "CLAIM-08-08", "CLAIM-08-09"],
  "claim_scope": [
    "lambda changes the fixed finite-horizon critic targets when bootstrap values are imperfect",
    "a fixed imagined terminal-reward error propagates to every earlier full-return target",
    "a continuation mask prevents a post-terminal reward from leaking into earlier targets",
    "a valid truncated transition keeps value bootstrap while a natural terminal transition closes it",
    "cumulative survival weights remove post-terminal steps from an imagined actor or critic objective",
    "a truncated row can retain next-state bootstrap while a separate lambda-trace mask prevents return recursion from crossing into an adjacent episode"
  ],
  "code": {
    "repository": "cv2embodied",
    "commit": "UNCOMMITTED",
    "config": "standard-library v4 analytic lambda-return, bootstrap, trace-boundary, and loss-weighting fixture"
  },
  "data": {
    "name": "hand-authored reward, discount, continuation, value, and per-step loss sequences",
    "version": "v4",
    "license": "MIT",
    "classification": "fixture",
    "fixture": true,
    "download_bytes": 0
  },
  "resources": {
    "tier": "S",
    "device": "CPU",
    "duration_seconds": 0,
    "peak_vram_bytes": null,
    "disk_bytes": 0,
    "gpu_verified": false
  },
  "commands": {
    "smoke": "make ch08-smoke",
    "evaluate": "python3 labs/track-a-world-model-control/ch08-imagination-learning/scripts/smoke.py",
    "report": "python3 labs/track-a-world-model-control/ch08-imagination-learning/scripts/smoke.py"
  },
  "metrics": [
    {"name": "lambda_0_start_target", "value": 0.4, "unit": "return", "split": "reference"},
    {"name": "lambda_0_5_start_target", "value": 0.65, "unit": "return", "split": "reference"},
    {"name": "lambda_1_start_target", "value": 1.0, "unit": "return", "split": "reference"},
    {"name": "biased_reward_start_target_gap", "value": 1.0, "unit": "return", "split": "biased-model"},
    {"name": "missing_continuation_mask_leakage_gap", "value": 10.0, "unit": "return", "split": "terminal-mask"},
    {"name": "collapsed_truncation_bootstrap_loss", "value": 4.0, "unit": "return", "split": "episode-end-semantics"},
    {"name": "post_terminal_loss_leakage", "value": 100.0, "unit": "loss contribution", "split": "imagined-loss-weighting"},
    {"name": "truncation_boundary_safe_start_target", "value": 5.0, "unit": "return", "split": "cross-episode-trace-boundary"},
    {"name": "truncation_boundary_ignored_start_target", "value": 101.0, "unit": "return", "split": "cross-episode-trace-boundary"},
    {"name": "cross_episode_start_target_leakage", "value": 96.0, "unit": "return", "split": "cross-episode-trace-boundary"}
  ],
  "artifacts": ["results/ch08/EXP-08-01-smoke.json"],
  "limitations": [
    "hand-authored scalar rewards and values rather than a learned world model or critic",
    "no gradients, actor update, replay buffer, neural network, simulator, or environment interaction",
    "the biased reward and collapsed-done cases are constructed counterexamples rather than measured model errors",
    "the two-row cross-episode fixture demonstrates an indexing failure but does not estimate replay corruption frequency or critic bias",
    "cumulative weights use hand-authored discounts and non-negative scalar losses rather than a specific Dreamer implementation's indexing, normalization, reduction, gradients, or learned continuation",
    "no Dreamer checkpoint, benchmark, GPU, robot, or vehicle"
  ]
}
