{
  "schema_version": 2,
  "id": "EXP-14-01",
  "chapter": 14,
  "status": "smoke",
  "claim_ids": ["CLAIM-14-02", "CLAIM-14-03", "CLAIM-14-04", "CLAIM-14-07", "CLAIM-14-08", "CLAIM-14-09"],
  "claim_scope": [
    "the conditional mean falls between two equally weighted valid scalar action modes",
    "iterative mode refinement trades model evaluations for distance to a valid mode",
    "an oracle straight-flow fixture reaches its assigned modes but does not represent learned flow-policy quality",
    "candidate count and batch capacity change sequential forward count even when solver steps are fixed",
    "data-mode validity remains distinct from independent scene-safety acceptance and deterministic fallback",
    "equal validity and mode coverage can hide a mismatch between generated and target mode frequencies"
  ],
  "code": {
    "repository": "cv2embodied",
    "commit": "UNCOMMITTED",
    "config": "standard-library v3 bimodal action, frequency-calibration, batching-budget, and candidate-gate fixture"
  },
  "data": {
    "name": "procedural symmetric two-mode scalar action fixture",
    "version": "v3",
    "license": "MIT",
    "classification": "fixture",
    "fixture": true,
    "download_bytes": 0
  },
  "resources": {
    "tier": "S",
    "device": "CPU",
    "duration_seconds": 0,
    "peak_vram_bytes": null,
    "disk_bytes": 0,
    "gpu_verified": false
  },
  "commands": {
    "smoke": "make ch14-smoke",
    "evaluate": "python3 labs/track-b-policy/ch14-generative-actions/scripts/smoke.py",
    "report": "python3 labs/track-b-policy/ch14-generative-actions/scripts/smoke.py"
  },
  "metrics": [
    {"name": "mse_mean_invalid_action_rate", "value": 1.0, "unit": "ratio", "split": "two-mode-action"},
    {"name": "refinement_1_step_mean_mode_distance", "value": 0.275, "unit": "action", "split": "fixed-base-samples"},
    {"name": "refinement_4_steps_mean_mode_distance", "value": 0.034375, "unit": "action", "split": "fixed-base-samples"},
    {"name": "refinement_4_steps_covered_modes", "value": 2, "unit": "mode", "split": "fixed-base-samples"},
    {"name": "oracle_flow_1_step_mean_mode_distance", "value": 0.0, "unit": "action", "split": "fixed-base-samples"},
    {"name": "balanced_mode_frequency_total_variation", "value": 0.0, "unit": "ratio", "split": "authored-equal-mode-target"},
    {"name": "imbalanced_mode_frequency_total_variation", "value": 0.4, "unit": "ratio", "split": "authored-equal-mode-target"},
    {"name": "sequential_10_candidate_4_step_forward_count", "value": 40, "unit": "forward", "split": "abstract-control-budget"},
    {"name": "single_batch_10_candidate_4_step_forward_count", "value": 4, "unit": "forward", "split": "abstract-control-budget"},
    {"name": "mixed_mode_safety_acceptance_count", "value": 5, "unit": "candidate", "split": "hand-authored-safety-gate"},
    {"name": "all_blocked_fallback_used", "value": 1.0, "unit": "boolean", "split": "hand-authored-safety-gate"}
  ],
  "artifacts": ["results/ch14/EXP-14-01-smoke.json"],
  "limitations": [
    "one-dimensional symmetric action modes with hand-selected base samples",
    "mode-refinement update is not a DDPM or learned denoiser",
    "straight flow uses oracle target assignment and cannot compare learned policy quality",
    "ten authored samples and a known equal target distribution do not estimate population calibration or uncertainty",
    "abstract forward budget does not measure batch-dependent wall-clock latency or memory",
    "hand-authored blocked interval and fallback are not a collision checker or safety policy"
  ]
}
