{
  "schema_version": 2,
  "id": "EXP-17-01",
  "chapter": 17,
  "status": "smoke",
  "claim_ids": ["CLAIM-17-02", "CLAIM-17-03", "CLAIM-17-07", "CLAIM-17-08", "CLAIM-17-10"],
  "claim_scope": [
    "high average transition agreement can coexist with a decision-critical model error",
    "a planner can exploit one optimistic model error and reverse the true policy ranking",
    "world-model utility must be measured with downstream return gaps and held-out true-environment anchors",
    "an explicit observed-support gate rejects the unsupported shortcut in this fixture and changes the selected policy",
    "the same gate accepts the erroneous shortcut and preserves exploitation regret when that state-action is authored as covered",
    "distinct transition, state-decoder, and outcome-scorer faults can be observationally equivalent at the final proxy-score interface"
  ],
  "code": {
    "repository": "cv2embodied",
    "commit": "UNCOMMITTED",
    "config": "standard-library corridor transition, policy-ranking, support-gate, and four-component attribution fixture"
  },
  "data": {
    "name": "procedural safe-route and phantom-shortcut transitions",
    "version": "v4",
    "license": "MIT",
    "classification": "fixture",
    "fixture": true,
    "download_bytes": 0
  },
  "resources": {
    "tier": "S",
    "device": "CPU",
    "duration_seconds": 0,
    "peak_vram_bytes": null,
    "disk_bytes": 0,
    "gpu_verified": false
  },
  "commands": {
    "smoke": "make ch17-smoke",
    "evaluate": "python3 labs/track-a-world-model-control/ch17-policy-utility/scripts/smoke.py",
    "report": "python3 labs/track-a-world-model-control/ch17-policy-utility/scripts/smoke.py"
  },
  "metrics": [
    {"name": "transition_agreement", "value": 0.8888888888888888, "unit": "ratio", "split": "nine-held-out-transitions"},
    {"name": "spearman_rank_correlation", "value": -0.5, "unit": "correlation", "split": "three-fixed-policies"},
    {"name": "maximum_absolute_return_gap", "value": 2.0, "unit": "return", "split": "three-fixed-policies"},
    {"name": "model_exploitation_regret", "value": 1.85, "unit": "return", "split": "ungated-model-selected-policy"},
    {"name": "support_gated_exploitation_regret", "value": 0.0, "unit": "return", "split": "two-supported-policies"},
    {"name": "unsupported_policy_rejection_rate", "value": 1.0, "unit": "ratio", "split": "one-unsupported-policy"},
    {"name": "in_support_error_rejected_policy_count", "value": 0, "unit": "count", "split": "three-covered-policies"},
    {"name": "in_support_error_exploitation_regret", "value": 1.85, "unit": "return", "split": "three-covered-policies"},
    {"name": "component_attribution_scenario_count", "value": 5, "unit": "count", "split": "oracle-plus-four-single-fault-scenarios"},
    {"name": "action_grounding_fault_exploitation_regret", "value": 1.05, "unit": "return", "split": "three-fixed-policies"},
    {"name": "observationally_equivalent_fault_count", "value": 3, "unit": "count", "split": "transition-decoder-scorer"},
    {"name": "equivalent_fault_exploitation_regret", "value": 1.85, "unit": "return", "split": "transition-decoder-scorer"}
  ],
  "artifacts": ["results/ch17/EXP-17-01-smoke.json"],
  "limitations": [
    "hand-authored deterministic corridor rather than a learned neural world model",
    "three fixed policies and one deliberately optimistic shortcut error",
    "return units and effect sizes do not represent any real task",
    "no images, learned uncertainty estimator, policy training, simulator, robot, vehicle, or GPU",
    "both support declarations are hand-authored rather than learned coverage estimates",
    "support membership cannot detect errors inside observed support or shared model bias",
    "component scenarios inject one deterministic fault at a time and do not estimate prevalence, interactions, independence, or an additive error budget",
    "the state decoder is represented by a terminal-label interface rather than learned pose, depth, or event extraction"
  ]
}
