{
  "schema_version": 2,
  "id": "EXP-07-01",
  "chapter": 7,
  "status": "smoke",
  "claim_ids": ["CLAIM-07-02", "CLAIM-07-03", "CLAIM-07-04", "CLAIM-07-07", "CLAIM-07-08", "CLAIM-07-09"],
  "claim_scope": [
    "finite planning horizon can change the first action in a fixed delayed-reward MDP",
    "a terminal value can extend a one-step planner in the same fixture",
    "under a fixed two-action post-disturbance budget, replanning can outperform a stale suffix on observed environment reward in one deterministic fixture",
    "a frozen terminal-value contribution remains distinguishable from observed environment reward in the fixed-budget objective",
    "expected return, empirical lower-tail return, and a fixed chance constraint can rank the same hand-authored actions differently",
    "for a non-integer empirical tail mass, fractional boundary weighting preserves the requested mass while a ceil-count comparator expands it"
  ],
  "code": {
    "repository": "cv2embodied",
    "commit": "UNCOMMITTED",
    "config": "standard-library two-action three-state planning fixture"
  },
  "data": {
    "name": "procedural delayed-reward MDP and observation labels",
    "version": "v4",
    "license": "MIT",
    "classification": "fixture",
    "fixture": true,
    "download_bytes": 0
  },
  "resources": {
    "tier": "S",
    "device": "CPU",
    "duration_seconds": 0,
    "peak_vram_bytes": null,
    "disk_bytes": 0,
    "gpu_verified": false
  },
  "commands": {
    "smoke": "make ch07-smoke",
    "evaluate": "python3 labs/track-a-world-model-control/ch07-model-planning/scripts/smoke.py",
    "report": "python3 labs/track-a-world-model-control/ch07-model-planning/scripts/smoke.py"
  },
  "metrics": [
    {"name": "horizon_1_return", "value": 0.0, "unit": "return", "split": "nominal"},
    {"name": "horizon_3_return", "value": 0.8, "unit": "return", "split": "nominal"},
    {"name": "fixed_budget_open_loop_environment_return", "value": -0.2, "unit": "return", "split": "fixed-disturbance-reward-only"},
    {"name": "fixed_budget_replanning_environment_return", "value": -0.1, "unit": "return", "split": "fixed-disturbance-reward-only"},
    {"name": "fixed_budget_replanning_bootstrapped_objective", "value": 0.7, "unit": "objective", "split": "fixed-disturbance-terminal-value"},
    {"name": "fixed_budget_replanning_terminal_value_contribution", "value": 1.0, "unit": "value", "split": "fixed-disturbance-terminal-value"},
    {"name": "fixed_value_bellman_gap", "value": 0.0, "unit": "backup", "split": "label-surrogate"},
    {"name": "risky_mean_return", "value": 0.8, "unit": "return", "split": "five-scenario-risk"},
    {"name": "risky_worst_20_percent_return", "value": -2.0, "unit": "return", "split": "five-scenario-risk"},
    {"name": "risky_failure_probability", "value": 0.2, "unit": "ratio", "split": "five-scenario-risk"},
    {"name": "risky_fractional_lower_30_percent_return", "value": -0.833333333333, "unit": "return", "split": "five-scenario-tail-mass-audit"},
    {"name": "risky_ceil_lower_30_percent_return", "value": -0.25, "unit": "return", "split": "five-scenario-tail-mass-audit"},
    {"name": "ceil_effective_tail_fraction", "value": 0.4, "unit": "ratio", "split": "five-scenario-tail-mass-audit"},
    {"name": "ceil_minus_fractional_tail_mean", "value": 0.583333333333, "unit": "return", "split": "five-scenario-tail-mass-audit"}
  ],
  "artifacts": ["results/ch07/EXP-07-01-smoke.json"],
  "limitations": [
    "known deterministic rules rather than a learned world model",
    "exhaustive enumeration rather than CEM, MCTS, or continuous optimization",
    "hand-authored exact terminal values",
    "one fixed disturbance and deadline; the legacy unequal-budget result is retained only as a protocol negative control",
    "the bootstrapped objective is not an observed environment return",
    "value-equivalence check covers one value function and does not establish universal equivalence",
    "five equally weighted hand-authored outcomes and the fractional boundary calculation do not estimate population CVaR, confidence intervals, real tail probabilities, or safety",
    "no simulator, neural network, policy learning, GPU, robot, or vehicle"
  ]
}
